{
  "registry_version": 1,
  "default_profile": "narrator",
  "profiles": {
    "narrator": {
      "display_name": "Narrator",
      "role": "public_narration",
      "status": "approved",
      "aliases": ["dm", "storyteller"],
      "direction": "Warm, measured, and observant, with restrained wonder.",
      "boundaries": ["Do not become grandiose or melodramatic", "Keep names, rules terms, and player choices exact"],
      "browser_voice": {"language": "en-US", "voice_index": 0, "rate": 0.90, "pitch": 0.96},
      "provider": {"name": null, "model": null, "voice_id": null}
    },
    "renn": {
      "display_name": "Renn Hazel",
      "role": "player_character_readback",
      "status": "approved",
      "aliases": ["renn_hazel"],
      "direction": "Grounded and attentive, with youthful confidence and practical warmth.",
      "boundaries": ["Never voice an unconfirmed player choice", "Avoid cartoon rabbit mannerisms"],
      "browser_voice": {"language": "en-US", "voice_index": 1, "rate": 0.97, "pitch": 1.03},
      "provider": {"name": null, "model": null, "voice_id": null}
    },
    "unknown_voice": {
      "display_name": "Unknown Voice",
      "role": "unidentified_speaker",
      "status": "approved",
      "aliases": ["unknown"],
      "direction": "Quiet, close, and ambiguous without becoming sinister by default.",
      "boundaries": ["Never caricature identity, culture, species, or disability"],
      "browser_voice": {"language": "en-US", "voice_index": 2, "rate": 0.86, "pitch": 0.92},
      "provider": {"name": null, "model": null, "voice_id": null}
    },
    "koori": {
      "display_name": "Koori",
      "role": "character",
      "status": "approved",
      "aliases": [],
      "direction": "Bright, youthful, warm, and lightly textured; emotionally open with gentle buoyancy and conversational charm.",
      "boundaries": ["Avoid swagger, shrillness, cynicism, melodrama, and cartoon delivery"],
      "browser_voice": {"language": "en-US", "voice_index": 3, "rate": 1.03, "pitch": 1.08},
      "provider": {"name": null, "model": null, "voice_id": null}
    },
    "maro": {
      "display_name": "Maro",
      "role": "character",
      "status": "approved",
      "aliases": [],
      "direction": "Soft-spoken, youthful, and slightly androgynous, with gentle warmth, quiet intelligence, and sincere restraint.",
      "boundaries": ["Avoid coldness, tension, monotony, and excessive whispering"],
      "browser_voice": {"language": "en-US", "voice_index": 4, "rate": 0.88, "pitch": 1.00},
      "provider": {"name": null, "model": null, "voice_id": null}
    },
    "amia": {
      "display_name": "Amia",
      "role": "character",
      "status": "approved",
      "aliases": [],
      "direction": "Warm, luminous, youthful, and clear, with sincere kindness, resilience, and a lightly melodic cadence.",
      "boundaries": ["Avoid sugary, shrill, or helpless delivery"],
      "browser_voice": {"language": "en-US", "voice_index": 5, "rate": 0.96, "pitch": 1.07},
      "provider": {"name": null, "model": null, "voice_id": null},
      "forms": {
        "land": {"rate_multiplier": 1.04, "pitch_delta": 0.00},
        "sea": {"rate_multiplier": 0.91, "pitch_delta": -0.02}
      }
    },
    "pudding_chan": {
      "display_name": "Pudding-Chan",
      "role": "character",
      "status": "approved",
      "aliases": ["pudding-chan", "puddingchan"],
      "direction": "Tiny, bright, buoyant, and crisp, with compact bursts and wholehearted comic reactions.",
      "boundaries": ["Avoid piercing volume, shouting, baby talk, and extreme nasality"],
      "browser_voice": {"language": "en-US", "voice_index": 6, "rate": 1.10, "pitch": 1.16},
      "provider": {"name": null, "model": null, "voice_id": null}
    },
    "enishi": {
      "display_name": "Enishi",
      "role": "character",
      "status": "approved",
      "aliases": [],
      "direction": "Calm, youthful, and quietly authoritative, with timeless stillness, economy, and restrained protectiveness.",
      "boundaries": ["Avoid monotony, whispering, elderly affect, villainy, and grandiosity"],
      "browser_voice": {"language": "en-US", "voice_index": 7, "rate": 0.84, "pitch": 0.94},
      "provider": {"name": null, "model": null, "voice_id": null}
    },
    "puchii": {
      "display_name": "Puchii",
      "role": "character",
      "status": "approved",
      "aliases": [],
      "direction": "Quick, sparkling, mischievous, and kinetic, with variable rhythm and sudden emphasis.",
      "boundaries": ["Keep words intelligible", "Do not turn energy into constant shouting"],
      "browser_voice": {"language": "en-US", "voice_index": 8, "rate": 1.13, "pitch": 1.12},
      "provider": {"name": null, "model": null, "voice_id": null}
    }
  },
  "performance_modifiers": {
    "measured": {"rate_multiplier": 0.92, "pitch_delta": -0.01},
    "urgent": {"rate_multiplier": 1.08, "pitch_delta": 0.02},
    "whispered": {"rate_multiplier": 0.90, "pitch_delta": -0.04},
    "joyful": {"rate_multiplier": 1.04, "pitch_delta": 0.03},
    "somber": {"rate_multiplier": 0.91, "pitch_delta": -0.03}
  }
}
